title,content,url,published_at
‘Shifting Toward Inevitability’: A Primer For Anxious Investors,"Tobias van Gils is the Founder and Head of Research at MLT Capital Investments AG.
getty
It is an unfortunate reality that investors are navigating a hyper-polarized landscape marked by political t… [+6626 chars]",https://www.forbes.com/councils/forbesfinancecouncil/2025/02/26/shifting-toward-inevitability-a-primer-for-anxious-investors/,2025-02-26T16:08:17Z
NASA wasted $400K of your money on union time last year: ‘Ripping off taxpayers’,"NASA spent more than $400,000 on taxpayer-funded union time over the 12 months ending Sept. 30, 2024, leading a GOP senator who has been probing federal expenditures on non-government work to accuse … [+3775 chars]",https://nypost.com/2025/02/26/us-news/nasa-wasted-400k-of-your-money-on-union-time-last-year-ripping-off-taxpayers/,2025-02-26T16:05:54Z
What's the CD interest rate forecast for spring 2025?,"Knowing the CD rate forecast can help you make a good decision about where to deposit your money this spring.
Getty Images
If you've been looking for a safe, simple way to earn hefty returns on you… [+6042 chars]",https://www.cbsnews.com/news/whats-the-cd-interest-rate-forecast-for-spring-2025/,2025-02-26T16:01:46Z
How to create an influencer contract (plus template),"The contracting phase of an influencer marketing partnership might not be the most exciting step, but its essential for setting expectations and protecting both parties.
When done right, its a strai… [+14135 chars]",https://sproutsocial.com/insights/influencer-contract-template/,2025-02-26T16:00:55Z
IBM releases new Granite 3.2 family of models that include reasoning when you want it,"Continuing its mission to carve out a niche in the enterprise artificial intelligence market, IBM Corp. today introduced a new family of its Granite AI models that include experimental reasoning capa… [+5667 chars]",https://siliconangle.com/2025/02/26/ibm-releases-new-granite-3-2-family-models-include-reasoning-want/,2025-02-26T16:00:31Z
What Microsoft's Majorana 1 means for the future of quantum computing,"Introduction
This week, Microsoft unveiled a new brain for quantum computers called Majorana 1. The chip, which fits in the palm of your hand, leverages what are known as topological qubits it sound… [+15393 chars]",https://www.neowin.net/editorials/what-microsofts-majorana-1-means-for-the-future-of-quantum-computing/,2025-02-26T16:00:01Z
ThoughtSpot Appoints Brad Roberts as Chief Financial Officer to Drive Growth and Scalability in the AI Era,"MOUNTAIN VIEW, Calif., Feb. 26, 2025 (GLOBE NEWSWIRE) -- ThoughtSpot
, the AI-native Intelligence Platform, has announced the appointment of Brad Roberts as Chief Financial Officer (CFO). This strat… [+4405 chars]",https://www.globenewswire.com/news-release/2025/02/26/3033115/0/en/ThoughtSpot-Appoints-Brad-Roberts-as-Chief-Financial-Officer-to-Drive-Growth-and-Scalability-in-the-AI-Era.html,2025-02-26T16:00:00Z
"Pneumonia, flu among top 10 medical insurance claims","THE top 10 illnesses most claimed for medical insurance include pneumonia, influenza and fever, says the Finance Ministry.
Its Deputy Minister Lim Hui Ying said that in some instances, the treatment… [+1551 chars]",https://www.thestar.com.my/news/nation/2025/02/27/pneumonia-flu-among-top-10-medical-insurance-claims,2025-02-26T16:00:00Z
Johanna Bartee Appointed to Boards of First Fed and First Northwest Bancorp,"PORT ANGELES, Wash., Feb. 26, 2025 (GLOBE NEWSWIRE) -- First Northwest Bancorp (NASDAQ: FNWB) and its subsidiary First Fed Bank are pleased to announce the appointment of Johanna Bartee to the Board … [+3033 chars]",https://www.globenewswire.com/news-release/2025/02/26/3033114/34744/en/Johanna-Bartee-Appointed-to-Boards-of-First-Fed-and-First-Northwest-Bancorp.html,2025-02-26T16:00:00Z
Boxing 'one step closer' to 2028 Olympics inclusion,"World Boxing has been granted provisional recognition as the sport's international federation by the International Olympic Committee (IOC).
Boxing is not currently part of the programme for Los Ange… [+1064 chars]",https://www.bbc.com/sport/olympics/articles/c9vym9l7w0ro,2025-02-26T15:56:44Z
